{
  "$schema": "http://json-schema.org/draft-07/schema#",
  "title": "Level",
  "type": "object",
  "required": ["id", "title", "world", "lessonIndex", "lang", "type", "difficulty", "goals", "starter", "grader", "rewards"],
  "properties": {
    "id": {"type": "string"},
    "title": {"type": "string"},
    "world": {"type": "string"},
    "lessonIndex": {"type": "integer"},
    "lang": {"type": "string", "enum": ["python", "javascript"]},
    "type": {"type": "string", "enum": ["io","grid-led","pixel-art","maze-bot","turtle","music","fixit","open"]},
    "difficulty": {"type": "integer", "minimum": 1, "maximum": 5},
    "goals": {"type": "array", "items": {"type": "string"}},
    "starter": {
      "type": "object",
      "required": ["blockly","code"],
      "properties": {
        "blockly": {"type": "string"},
        "code": {"type": "string"}
      }
    },
    "assets": {"type": "object"},
    "grader": {"type": "object"},
    "rewards": {"type": "object"},
    "hints": {"type": "array", "items": {"type": "string"}},
    "examples": {"type": "array", "items": {"type": "object"}}
  }
}
